{"cohort_digest":"f62cab0581e498c558a3ab1204f7e0eed20112548730ae134308dc2ae13ebef0","folds":[{"fold_id":"fold-000","repeat_id":"0","test_ids":["SYN-obs-000001-000","SYN-obs-000001-001","SYN-obs-000005-000","SYN-obs-000005-001","SYN-obs-000009-000","SYN-obs-000009-001","SYN-obs-000011-000","SYN-obs-000011-001","SYN-obs-000013-000","SYN-obs-000013-001","SYN-obs-000014-000","SYN-obs-000014-001","SYN-obs-000018-000","SYN-obs-000018-001","SYN-obs-000022-000","SYN-obs-000022-001","SYN-obs-000029-000","SYN-obs-000029-001","SYN-obs-000030-000","SYN-obs-000030-001","SYN-obs-000031-000","SYN-obs-000031-001","SYN-obs-000032-000","SYN-obs-000032-001","SYN-obs-000034-000","SYN-obs-000034-001","SYN-obs-000035-000","SYN-obs-000035-001","SYN-obs-000040-000","SYN-obs-000040-001","SYN-obs-000046-000","SYN-obs-000046-001","SYN-obs-000049-000","SYN-obs-000049-001","SYN-obs-000054-000","SYN-obs-000054-001","SYN-obs-000055-000","SYN-obs-000055-001","SYN-obs-000058-000","SYN-obs-000058-001"],"train_ids":["SYN-obs-000000-000","SYN-obs-000000-001","SYN-obs-000002-000","SYN-obs-000002-001","SYN-obs-000003-000","SYN-obs-000003-001","SYN-obs-000004-000","SYN-obs-000004-001","SYN-obs-000006-000","SYN-obs-000006-001","SYN-obs-000007-000","SYN-obs-000007-001","SYN-obs-000008-000","SYN-obs-000008-001","SYN-obs-000010-000","SYN-obs-000010-001","SYN-obs-000012-000","SYN-obs-000012-001","SYN-obs-000015-000","SYN-obs-000015-001","SYN-obs-000016-000","SYN-obs-000016-001","SYN-obs-000017-000","SYN-obs-000017-001","SYN-obs-000019-000","SYN-obs-000019-001","SYN-obs-000020-000","SYN-obs-000020-001","SYN-obs-000021-000","SYN-obs-000021-001","SYN-obs-000023-000","SYN-obs-000023-001","SYN-obs-000024-000","SYN-obs-000024-001","SYN-obs-000025-000","SYN-obs-000025-001","SYN-obs-000026-000","SYN-obs-000026-001","SYN-obs-000027-000","SYN-obs-000027-001","SYN-obs-000028-000","SYN-obs-000028-001","SYN-obs-000033-000","SYN-obs-000033-001","SYN-obs-000036-000","SYN-obs-000036-001","SYN-obs-000037-000","SYN-obs-000037-001","SYN-obs-000038-000","SYN-obs-000038-001","SYN-obs-000039-000","SYN-obs-000039-001","SYN-obs-000041-000","SYN-obs-000041-001","SYN-obs-000042-000","SYN-obs-000042-001","SYN-obs-000043-000","SYN-obs-000043-001","SYN-obs-000044-000","SYN-obs-000044-001","SYN-obs-000045-000","SYN-obs-000045-001","SYN-obs-000047-000","SYN-obs-000047-001","SYN-obs-000048-000","SYN-obs-000048-001","SYN-obs-000050-000","SYN-obs-000050-001","SYN-obs-000051-000","SYN-obs-000051-001","SYN-obs-000052-000","SYN-obs-000052-001","SYN-obs-000053-000","SYN-obs-000053-001","SYN-obs-000056-000","SYN-obs-000056-001","SYN-obs-000057-000","SYN-obs-000057-001","SYN-obs-000059-000","SYN-obs-000059-001"]},{"fold_id":"fold-001","repeat_id":"0","test_ids":["SYN-obs-000002-000","SYN-obs-000002-001","SYN-obs-000003-000","SYN-obs-000003-001","SYN-obs-000006-000","SYN-obs-000006-001","SYN-obs-000008-000","SYN-obs-000008-001","SYN-obs-000010-000","SYN-obs-000010-001","SYN-obs-000019-000","SYN-obs-000019-001","SYN-obs-000020-000","SYN-obs-000020-001","SYN-obs-000023-000","SYN-obs-000023-001","SYN-obs-000027-000","SYN-obs-000027-001","SYN-obs-000028-000","SYN-obs-000028-001","SYN-obs-000042-000","SYN-obs-000042-001","SYN-obs-000043-000","SYN-obs-000043-001","SYN-obs-000044-000","SYN-obs-000044-001","SYN-obs-000045-000","SYN-obs-000045-001","SYN-obs-000047-000","SYN-obs-000047-001","SYN-obs-000050-000","SYN-obs-000050-001","SYN-obs-000051-000","SYN-obs-000051-001","SYN-obs-000053-000","SYN-obs-000053-001","SYN-obs-000057-000","SYN-obs-000057-001","SYN-obs-000059-000","SYN-obs-000059-001"],"train_ids":["SYN-obs-000000-000","SYN-obs-000000-001","SYN-obs-000001-000","SYN-obs-000001-001","SYN-obs-000004-000","SYN-obs-000004-001","SYN-obs-000005-000","SYN-obs-000005-001","SYN-obs-000007-000","SYN-obs-000007-001","SYN-obs-000009-000","SYN-obs-000009-001","SYN-obs-000011-000","SYN-obs-000011-001","SYN-obs-000012-000","SYN-obs-000012-001","SYN-obs-000013-000","SYN-obs-000013-001","SYN-obs-000014-000","SYN-obs-000014-001","SYN-obs-000015-000","SYN-obs-000015-001","SYN-obs-000016-000","SYN-obs-000016-001","SYN-obs-000017-000","SYN-obs-000017-001","SYN-obs-000018-000","SYN-obs-000018-001","SYN-obs-000021-000","SYN-obs-000021-001","SYN-obs-000022-000","SYN-obs-000022-001","SYN-obs-000024-000","SYN-obs-000024-001","SYN-obs-000025-000","SYN-obs-000025-001","SYN-obs-000026-000","SYN-obs-000026-001","SYN-obs-000029-000","SYN-obs-000029-001","SYN-obs-000030-000","SYN-obs-000030-001","SYN-obs-000031-000","SYN-obs-000031-001","SYN-obs-000032-000","SYN-obs-000032-001","SYN-obs-000033-000","SYN-obs-000033-001","SYN-obs-000034-000","SYN-obs-000034-001","SYN-obs-000035-000","SYN-obs-000035-001","SYN-obs-000036-000","SYN-obs-000036-001","SYN-obs-000037-000","SYN-obs-000037-001","SYN-obs-000038-000","SYN-obs-000038-001","SYN-obs-000039-000","SYN-obs-000039-001","SYN-obs-000040-000","SYN-obs-000040-001","SYN-obs-000041-000","SYN-obs-000041-001","SYN-obs-000046-000","SYN-obs-000046-001","SYN-obs-000048-000","SYN-obs-000048-001","SYN-obs-000049-000","SYN-obs-000049-001","SYN-obs-000052-000","SYN-obs-000052-001","SYN-obs-000054-000","SYN-obs-000054-001","SYN-obs-000055-000","SYN-obs-000055-001","SYN-obs-000056-000","SYN-obs-000056-001","SYN-obs-000058-000","SYN-obs-000058-001"]},{"fold_id":"fold-002","repeat_id":"0","test_ids":["SYN-obs-000000-000","SYN-obs-000000-001","SYN-obs-000004-000","SYN-obs-000004-001","SYN-obs-000007-000","SYN-obs-000007-001","SYN-obs-000012-000","SYN-obs-000012-001","SYN-obs-000015-000","SYN-obs-000015-001","SYN-obs-000016-000","SYN-obs-000016-001","SYN-obs-000017-000","SYN-obs-000017-001","SYN-obs-000021-000","SYN-obs-000021-001","SYN-obs-000024-000","SYN-obs-000024-001","SYN-obs-000025-000","SYN-obs-000025-001","SYN-obs-000026-000","SYN-obs-000026-001","SYN-obs-000033-000","SYN-obs-000033-001","SYN-obs-000036-000","SYN-obs-000036-001","SYN-obs-000037-000","SYN-obs-000037-001","SYN-obs-000038-000","SYN-obs-000038-001","SYN-obs-000039-000","SYN-obs-000039-001","SYN-obs-000041-000","SYN-obs-000041-001","SYN-obs-000048-000","SYN-obs-000048-001","SYN-obs-000052-000","SYN-obs-000052-001","SYN-obs-000056-000","SYN-obs-000056-001"],"train_ids":["SYN-obs-000001-000","SYN-obs-000001-001","SYN-obs-000002-000","SYN-obs-000002-001","SYN-obs-000003-000","SYN-obs-000003-001","SYN-obs-000005-000","SYN-obs-000005-001","SYN-obs-000006-000","SYN-obs-000006-001","SYN-obs-000008-000","SYN-obs-000008-001","SYN-obs-000009-000","SYN-obs-000009-001","SYN-obs-000010-000","SYN-obs-000010-001","SYN-obs-000011-000","SYN-obs-000011-001","SYN-obs-000013-000","SYN-obs-000013-001","SYN-obs-000014-000","SYN-obs-000014-001","SYN-obs-000018-000","SYN-obs-000018-001","SYN-obs-000019-000","SYN-obs-000019-001","SYN-obs-000020-000","SYN-obs-000020-001","SYN-obs-000022-000","SYN-obs-000022-001","SYN-obs-000023-000","SYN-obs-000023-001","SYN-obs-000027-000","SYN-obs-000027-001","SYN-obs-000028-000","SYN-obs-000028-001","SYN-obs-000029-000","SYN-obs-000029-001","SYN-obs-000030-000","SYN-obs-000030-001","SYN-obs-000031-000","SYN-obs-000031-001","SYN-obs-000032-000","SYN-obs-000032-001","SYN-obs-000034-000","SYN-obs-000034-001","SYN-obs-000035-000","SYN-obs-000035-001","SYN-obs-000040-000","SYN-obs-000040-001","SYN-obs-000042-000","SYN-obs-000042-001","SYN-obs-000043-000","SYN-obs-000043-001","SYN-obs-000044-000","SYN-obs-000044-001","SYN-obs-000045-000","SYN-obs-000045-001","SYN-obs-000046-000","SYN-obs-000046-001","SYN-obs-000047-000","SYN-obs-000047-001","SYN-obs-000049-000","SYN-obs-000049-001","SYN-obs-000050-000","SYN-obs-000050-001","SYN-obs-000051-000","SYN-obs-000051-001","SYN-obs-000053-000","SYN-obs-000053-001","SYN-obs-000054-000","SYN-obs-000054-001","SYN-obs-000055-000","SYN-obs-000055-001","SYN-obs-000057-000","SYN-obs-000057-001","SYN-obs-000058-000","SYN-obs-000058-001","SYN-obs-000059-000","SYN-obs-000059-001"]}],"objective":"unseen_participant","origin":"generated","plan_id":"e305cf1919d167367a02c6a4299efffea762ef24c4962a6b0c934aff0913057a","schema_version":"1.0","scheme":"subject_kfold","seed":2026}
