{
  "schema_version": "1.0",
  "plan_id": "fixture-participant-overlap",
  "origin": "imported",
  "cohort_digest": null,
  "objective": "unseen_participant",
  "scheme": "imported",
  "seed": null,
  "folds": [
    {
      "repeat_id": "0",
      "fold_id": "fold-000",
      "train_ids": [
        "obs-001-2",
        "obs-002-2",
        "obs-003-2",
        "obs-004-2",
        "obs-005-2",
        "obs-006-2",
        "obs-007-2",
        "obs-008-2",
        "obs-009-2",
        "obs-010-2",
        "obs-011-2",
        "obs-012-2",
        "obs-013-2",
        "obs-014-2",
        "obs-015-2",
        "obs-016-2",
        "obs-017-2",
        "obs-018-2"
      ],
      "test_ids": [
        "obs-001-1",
        "obs-002-1",
        "obs-003-1",
        "obs-004-1",
        "obs-005-1",
        "obs-006-1",
        "obs-007-1",
        "obs-008-1",
        "obs-009-1",
        "obs-010-1",
        "obs-011-1",
        "obs-012-1",
        "obs-013-1",
        "obs-014-1",
        "obs-015-1",
        "obs-016-1",
        "obs-017-1",
        "obs-018-1"
      ],
      "inner_folds": []
    },
    {
      "repeat_id": "0",
      "fold_id": "fold-001",
      "train_ids": [
        "obs-001-1",
        "obs-002-1",
        "obs-003-1",
        "obs-004-1",
        "obs-005-1",
        "obs-006-1",
        "obs-007-1",
        "obs-008-1",
        "obs-009-1",
        "obs-010-1",
        "obs-011-1",
        "obs-012-1",
        "obs-013-1",
        "obs-014-1",
        "obs-015-1",
        "obs-016-1",
        "obs-017-1",
        "obs-018-1"
      ],
      "test_ids": [
        "obs-001-2",
        "obs-002-2",
        "obs-003-2",
        "obs-004-2",
        "obs-005-2",
        "obs-006-2",
        "obs-007-2",
        "obs-008-2",
        "obs-009-2",
        "obs-010-2",
        "obs-011-2",
        "obs-012-2",
        "obs-013-2",
        "obs-014-2",
        "obs-015-2",
        "obs-016-2",
        "obs-017-2",
        "obs-018-2"
      ],
      "inner_folds": []
    }
  ]
}
